Name,Description
Hadron Engine,Turns the ground into Electric Terrain when the Pokemon enters a battle. The futuristic engine within the Pokemon also boosts its Sp. Atk stat on Electric Terrain.
Opportunist,"If an opponent's stat is boosted, the Pokemon seizes the opportunity to boost the same stat for itself."
Cud Chew,"When the Pokemon eats a Berry, it will regurgitate that Berry at the end of the next turn and eat it one more time."
Sharpness,Powers up slicing moves.
Supreme Overlord,"When the Pokemon enters a battle, its Attack and Sp. Atk stats are slightly boosted for each of the allies in its party that have already been defeated."
Costar,"When the Pokemon enters a battle, it copies an ally's stat changes."
Toxic Debris,Scatters poison spikes at the feet of the opposing team when the Pokemon takes damage from physical moves.
Armor Tail,The mysterious tail covering the Pokemon's head makes opponents unable to use priority moves against the Pokemon or its allies.
Earth Eater,"If hit by a Ground-type move, the Pokemon has its HP restored instead of taking damage."
Mycelium Might,"The Pokemon will always act more slowly when using status moves, but these moves will be unimpeded by the Ability of the target."
Hospitality,"When the Pokemon enters a battle, it showers its ally with hospitality, restoring a small amount of the ally's HP."
Mind's Eye,"The Pokemon ignores changes to opponents' evasiveness, its accuracy can't be lowered, and it can hit Ghost types with Normal- and Fighting-type moves."
Embody Aspect,"The Pokemon's heart fills with memories, causing the Teal Mask to shine and the Pokemon's Speed stat to be boosted."
Embody Aspect,"The Pokemon's heart fills with memories, causing the Hearthflame Mask to shine and the Pokemon's Attack stat to be boosted."
Embody Aspect,"The Pokemon's heart fills with memories, causing the Wellspring Mask to shine and the Pokemon's Sp. Def stat to be boosted."
Embody Aspect,"The Pokemon's heart fills with memories, causing the Cornerstone Mask to shine and the Pokemon's Defense stat to be boosted."
Toxic Chain,The power of the Pokemon's toxic chain may badly poison any target the Pokemon hits with a move.
Supersweet Syrup,"A sickly sweet scent spreads across the field the first time the Pokemon enters a battle, lowering the evasiveness of opposing Pokemon."
Tera Shift,"When the Pokemon enters a battle, it absorbs the energy around itself and transforms into its Terastal Form."
Tera Shell,The Pokemon's shell contains the powers of each type. All damage-dealing moves that hit the Pokemon when its HP is full will not be very effective.
Teraform Zero,"When Terapagos changes into its Stellar Form, it uses its hidden powers to eliminate all effects of weather and terrain, reducing them to zero."
Poison Puppeteer,Pokemon poisoned by Pecharunt's moves will also become confused.
